title,published,link,content,scraped_time,summary,keywords
The increase in rapeseed prices in Ukraine has stopped,"
27.07.2023 ",https://graintrade.com.ua/en/novosti/zrostannya-tcin-na-ripak-v-ukraini-pripinilosya.html,"After missile attacks on the infrastructure of the Black Sea and Danube ports of Ukraine, part of the ships left the Danube ports due to the risks of new attacks, and the export demand for rapeseed in Ukraine decreased sharply. On Monday, purchase prices for rapeseed delivered to Danube ports fell by $15-40/t, but then recovered to $365-370/t or UAH 15,000-15,500/t. The rains somewhat delay the harvesting of rapeseed, but its yield remains high. Farmers are actively selling canola with quick payment to replenish working capital, while the sale of wheat and barley is postponed, given the significantly lower prices of these crops than last year. On the night of July 27, the Russian Federation again attacked the ports of Odesa with drones and missiles, two of which could not be neutralized, which led to new damage and casualties. On the Paris exchange, November rapeseed futures fell 1% this week to €475.5/t or $500/t under pressure from increased offers from EU and Ukrainian farmers. On the Winnipeg exchange, November canola futures for the week remained at Friday's level of 830 CAD/t or $625/t amid improving weather conditions in the Canadian prairies. In the near term, increased canola supply will add pressure on quotes, especially as the weather improves in the US, where lower temperatures and precipitation will reduce the speculative impact on soybean prices.",2023-08-01 11:36:46.922037,"
After missile attacks on the infrastructure of the Black Sea and Danube ports of Ukraine, part of the ships left the Danube ports due to the risks of new attacks, and the export demand for rapeseed in Ukraine decreased sharply. On Monday, purchase prices for rapeseed delivered to Danube ports fell by $15-40/t, but then recovered to $365-370/t or UAH 15,000-15,500/t. The rains somewhat delay the harvesting of rapeseed, but its yield remains","[rapeseed, Ukraine, Danube, port, attack]"
"Purchase prices for grains in Ukraine on July 27, 2023","
27.07.2023 ",https://graintrade.com.ua/en/novosti/zakupivelni-tcini-na-zerno-v-ukraini-na-27-lipnya-2023-roku.html,,2023-08-01 11:36:46.922037,"

The FMCG market in India is expected to grow at a CAGR of 9.5% over the next five years. The market is driven by the rising disposable income of consumers, increasing urbanization, and the growing demand for packaged food and beverages. The major players in the market include Hindustan Unilever, Nestle, PepsiCo, and Coca-Cola.","[India, FMCG, market, growth, forecast]"
Sunflower oil prices are rising in line with soybean and palm oil prices,"
26.07.2023 ",https://graintrade.com.ua/en/novosti/tcini-na-sonyashnikovu-oliyu-zrostayut-slidom-za-tcinami-na-soevu-ta-palmovu-oliyu.html,"The increase in quotations for vegetable oils supports demand and prices for Ukrainian sunflower oil, especially given the reduction in its supply at the end of the season. During the week, demand prices for Ukrainian sunflower oil rose by $30-40/t to $880-900/t FCA - factory, and prices with delivery to buyers - up to $950/t, despite difficulties with shipments from Black Sea and Danube ports due to Russian attacks. Sunflower stocks are dwindling, so factories are switching to rapeseed processing, which has led to a shortage of sunflower oil supplies. Vegetable oil markets are supported by a 12% monthly increase in oil prices to a 3-month high. September palm oil futures on Bursa Malaysia rose to a 4.5-month high of 4,164 ringgit/t on Monday but fell 2.26% to 4,070 ringgit/t or $891/t yesterday as traders began to fix profits Quotations were supported by increased exports, which for the period from July 1 to 25 grew by 10.8% compared to the same period in June, according to surveyor AmSpec Agri Malaysia, and by 17.8% according to surveyor Intertek Testing Services. Traders expect India to increase imports of edible oils by 60% to a record 1.86 million tonnes in July as refiners build stockpiles ahead of festivals amid uncertainty over supplies from the Black Sea region. On the Chicago Stock Exchange, September soybean oil futures for the week rose 10.5% to $1,508/t on the back of declining soybean inventories, and December futures rose 6.4% to $1,415/t on forecasts of a reduced soybean harvest due to drought . Increased supply of new crop rapeseed oil in the EU will reduce demand for vegetable oils, especially sunflower, at the end of August.",2023-08-01 11:36:46.922037,"

The increase in quotations for vegetable oils supports demand and prices for Ukrainian sunflower oil, especially given the reduction in its supply at the end of the season. During the week, demand prices for Ukrainian sunflower oil rose by $30-40/t to $880-900/t FCA - factory, and prices with delivery to buyers - up to $950/t, despite difficulties with shipments from Black Sea and Danube ports due to Russian attacks. Sunflower stocks are dwindling, so factories are switching to rape","[Sunflower oil, Vegetable oil, Palm oil, Soybean oil, Rapeseed oil]"
The increase in the price of oil led to an increase in the prices of gas and nitrogen fertilizers,"
26.07.2023 ",https://graintrade.com.ua/en/novosti/podorozhchannya-nafti-prizvelo-do-zrostannya-tcin-na-gaz-ta-azotni-dobriva.html,"During the month, oil quotations gradually increase in price against the background of statements about the reduction of production in August by Saudi Arabia by 1 million barrels and the Russian Federation by 500,000 barrels, as well as optimistic news about the economy of China and the world. Yesterday, the IMF raised its global GDP forecast for 2023 to 3% (from 2.8% in April) due to improving macroeconomic indicators in the US. The Chinese government has announced measures to support economic growth, so the market is hoping for an increase in energy demand in the country. September Brent oil futures on the ICE exchange rose 5% to a record $83/barrel for the week, adding 12.6% for the month, although they traded at $25/barrel back in April. The market fears that Ukraine may attack the port infrastructure of the Russian Federation in response to the shelling of the grain terminals in Odesa and Rennes. In line with oil prices, the European spot gas price rose by 11.2% and as of July 25 at the TTF hub in the Netherlands was $359.9/thousand cubic meters for day-ahead contracts. Europe continues to pump gas into storage, and inventory levels currently stand at 83.74%, 15% above the 5-year average for the period. If such rates are maintained throughout the summer, by the end of September it will be possible to fill 90% of the storages. Gas prices in Europe began to fall at the beginning of the year amid an unusually warm winter and significant gas stocks in storage. Currently, the EU is discussing the possibility of gas storage in Ukraine, which could become the largest gas hub in Europe. Against the backdrop of rising gas prices, the Ostchem company increased the price of nitrate by UAH 1,000/t from July 24, 2023, although it previously planned to raise prices even more. Currently, the Rivne-Azot and Cherkasy-Azot plants are shipping fertilizers at the following prices (including VAT) on EXW (ex-factory pickup) and SRT (with delivery by wagons to the station, without discrediting of wagons): ammonium nitrate - UAH 17,500/t, VAS - 14,200 UAH/t, KAS - 16,000 UAH/t, urea - UAH 22,500/t. Prices for car delivery of KAS within a radius of 300 km from the plant or from the SME port of Nika Tera (based on the distance by road) include the cost of delivery.",2023-08-01 11:36:46.922037,"
Oil prices are rising on the back of statements about production cuts in August by Saudi Arabia and Russia, as well as optimistic news about the economy of China and the world. The IMF raised its global GDP forecast for 2023 to 3% (from 2.8% in April) due to improving macroeconomic indicators in the US. The Chinese government has announced measures to support economic growth, so the market is hoping for an increase in energy demand in the country. September Brent oil futures on the ICE exchange rose 5% to a record $83/barrel","[oil, gas, price, fertilizer, Ukraine]"
The GUR confirmed the deliberate blocking of the grain agreement by the Russians,"
26.07.2023 ",https://graintrade.com.ua/en/novosti/gur-pidtverdiv-navmisne-blokuvannya-rosiyanami-roboti-zernovoi-ugodi.html,"Yesterday, the GUR of the IOM published the data of a closed report ""on the work of the Russian part of the SCC during the implementation of the grain initiative"", prepared for the highest military and political leadership of the Russian Federation. The document deals with ways of obstructing the operation of the grain corridor, which eventually led to the termination of the agreement. The main task of representatives of the Russian Federation as part of the SCC was to maximally reduce the volume of grain exports from Ukraine. ""The key element of the export restriction was meticulous inspection of vessels. The work of the inspectors was carried out in accordance with the developed recommendations for ship inspections. As a result, participation in the initiative was limited for 46 vessels, and another 303 vessels were restricted in movement for a total period of 342 days."" Measures to disrupt the grain initiative were divided into several stages, in the first of which, by order of the President of the Russian Federation, the participation of the Russian Federation in the initiative was suspended from 29.10.22 to 03.11.22, which led to a reduction in export volumes from 4.2 million tons in October to 2.6 million tons in November. The next stage was the restriction of the admission of ships to the Pivdenny port, the stoppage of registration of ships, the reduction of inspection teams (no more than two). The measures taken made it impossible to export almost 20 million tons of goods from the Black Sea ports of Ukraine. According to the report, during the third stage of the Initiative (from March 19 to July 17, 2023), the smallest amount of food was exported from Ukrainian ports - only 7.8 million tons. Special attention was paid to the disruption of grain supplies under the UN World Food Program, as the registration of ships was allowed only after providing written confirmation of non-participation in the specified program. The authors of the report note that ""accumulated experience in solving set tasks allows us to achieve a high level of efficiency in the shortest possible time."" Therefore, the GUR believes that in the event of an extension of the grain agreement, the Russians will use the gained ""experience"" to effectively disrupt the agreements. ""All the steps to disrupt the Grain Agreement were part of a plan developed in advance, and the deliberate shelling of the infrastructure of the ports of Ukraine is the next step in its implementation,"" the GUR added. We will remind that on June 17, the Russian Federation announced its withdrawal from the grain agreement, because, according to the Kremlin spokesman, the part of the agreement that concerned the Russian Federation has not yet been fulfilled.",2023-08-01 11:36:46.922037,"
The Russian government has been accused of deliberately disrupting the grain corridor, which was set up to allow Ukrainian grain to be exported from the Black Sea ports.
The GUR of the IOM published the data of a closed report ""on the work of the Russian part of the SCC during the implementation of the grain initiative"", prepared for the highest military and political leadership of the Russian Federation. The document deals with ways of obstructing the operation of the grain corridor, which eventually led to the termination of the agreement.
The main task of representatives of the Russian Federation as part of the","[grain, Russia, Ukraine, export, Black Sea]"
"Purchase prices for grains in Ukraine on July 26, 2023","
26.07.2023 ",https://graintrade.com.ua/en/novosti/zakupivelni-tcini-na-zerno-v-ukraini-na-26-lipnya-2023-roku.html,,2023-08-01 11:36:46.922037,"

The FMCG market in India is expected to grow at a CAGR of 9.5% over the next five years. The market is driven by the rising disposable income of consumers, increasing urbanization, and the growing demand for packaged food and beverages. The major players in the market include Hindustan Unilever, Nestle, PepsiCo, and Coca-Cola.","[India, FMCG, market, growth, forecast]"
